{
  "$schema": "../schemas/alarm_cables.schema.json",
  "schemaVersion": 1,
  "verified": false,
  "notes": [
    "Кабели линий АПС для кабельного журнала (ADR 0012). Требование СП 6.13130.2025: электропроводки и линии связи СПЗ — кабелями с медными жилами по ГОСТ 31565 и области применения по прил. Г (для СПЗ — исполнение нг(А)-FRLS или нг(А)-FRHF), время работоспособности — п. 6.17, табл. 6.2; исключения — п. 6.3. Конкретные марки ниже — выбор программы по умолчанию, не норма; при другой марке проекта правятся здесь.",
    "Длины ДПЛС по сечению и суммарному току адресных устройств — табл. 1.4.2.6.1 РЭ С2000-КДЛ (изм. 10 от 13.07.2026, с. 8–9): просадка на АУ не более 2 В, сопротивление линии не более 200 Ом, ёмкость не более 0,1 мкФ; значения со звёздочкой ограничены ёмкостью кабеля. Длина кольцевой линии считается при обрыве кольца у клемм контроллера — то есть по полной длине кольца.",
    "Запас длины на раскладку и подключение — решение проектировщика; принят коэффициент reserve."
  ],
  "reserve": 1.1,
  "inCabinetM": 3,
  "loop": {
    "name": "КПСнг(А)-FRLS 1×2×{section}",
    "note": "двухпроводная линия связи ДПЛС, витая пара",
    "maxLengthKm": [
      { "section": 0.2, "byLoadMa": { "16": 0.65, "32": 0.33, "48": 0.22, "64": 0.16 } },
      { "section": 0.5, "byLoadMa": { "16": 1.62, "32": 0.82, "48": 0.55, "64": 0.40 } },
      { "section": 0.75, "byLoadMa": { "16": 1.43, "32": 1.23, "48": 0.82, "64": 0.61 } },
      { "section": 1.0, "byLoadMa": { "16": 1.33, "32": 1.33, "48": 1.11, "64": 0.83 } },
      { "section": 1.5, "byLoadMa": { "16": 1.25, "32": 1.25, "48": 1.25, "64": 1.24 } },
      { "section": 2.5, "byLoadMa": { "16": 1.18, "32": 1.18, "48": 1.18, "64": 1.18 } }
    ],
    "source": "РЭ С2000-КДЛ АЦДР.426469.012 РЭп, изм. 10 от 13.07.2026, п. 1.4.2.6, табл. 1.4.2.6.1, с. 8–9 (bolid.ru/files/373/566/s2000_kdl_rep_jule_26.pdf)"
  },
  "power": { "name": "КПСнг(А)-FRLS 2×2×0,75", "note": "питание 12 В от РИП к контроллерам в пределах пожарного поста" },
  "mains": { "name": "ВВГнг(А)-FRLS 3×1,5", "note": "220 В от ВРУ (I категория, СП 6 п. 5.21) к РИП; длина — по месту ВРУ" },
  "signal": { "name": "КПСнг(А)-FRLS 1×2×0,5", "note": "сигналы АУПТ (сухие контакты датчиков положения, сигнализаторов давления, шкафа) ко входам модуля в насосной" }
}
